{
  "schema_version": 1,
  "record_type": "sourcelens_aios_p1_063_quality_task_card",
  "status": "QUALITY_FREEZE_CANDIDATE",
  "freeze_effective_only_with_external_quality_receipt": true,
  "task_id": "AIOS-P1-063_CLEAN_ROOM_OFFLINE_RESULT_ADMISSION_AND_B0_ADAPTER",
  "control_id": "SL-P1-REP-001-RANGE-NORMALIZATION",
  "quality_owner": "Quality and Evaluation Agent",
  "worker_may_modify": false,
  "identity": {
    "activation_commit": "2a6199b93dbcd1cdab9fb25d1dbbbd5b2a9a874f",
    "contract": {
      "path": "docs/aios/tasks/P1-063_CLEAN_ROOM_OFFLINE_RESULT_ADMISSION_AND_B0_ADAPTER.yaml",
      "byte_length": 7788,
      "sha256": "fb857885e6d17d50acd9c0d0b9ada14faa56f9e3cca5e1de92bdb95cdcf26946"
    },
    "authority": {
      "path": "/Users/lijunpeng/Developer/.sourcelens-audit/p1-063-direct-engineering-v1-zIDwM3Va/authority/TASK_AUTHORITY.yaml",
      "sha256": "e540ec01e5f9568447a583f0c1500829f272897e9d3bc3b4bf5d4a9c928e42c3"
    },
    "write_allowlist": {
      "path": "/Users/lijunpeng/Developer/.sourcelens-audit/p1-063-direct-engineering-v1-zIDwM3Va/authority/INTERNAL_WRITE_ALLOWLIST.json",
      "byte_length": 4357,
      "sha256": "a8ff4bfa11083bb3818d777536f6ab4b6282a37913d63780af027dee607d6af8"
    }
  },
  "quality_assets": {
    "evaluator": "evaluation-harness/evaluator/p1-063-offline-b0-finite-ir-v1/quality-evaluator.mjs",
    "task_card_schema": "evaluation-harness/fixtures/p1-063-offline-b0-finite-ir-v1/task-card.schema.json",
    "offline_submission_schema": "evaluation-harness/fixtures/p1-063-offline-b0-finite-ir-v1/offline-submission.schema.json",
    "offline_submission": "evaluation-harness/fixtures/p1-063-offline-b0-finite-ir-v1/offline-submission.json",
    "expected_results": "evaluation-harness/fixtures/p1-063-offline-b0-finite-ir-v1/expected-results.json",
    "negative_cases": "evaluation-harness/fixtures/p1-063-offline-b0-finite-ir-v1/negative-cases.json",
    "golden_stable_projection": "evaluation-harness/fixtures/p1-063-offline-b0-finite-ir-v1/golden-stable-projection.json"
  },
  "accepted_inputs": {
    "task_spec": {
      "path": "evaluation-harness/datasets/p1-representative-task-dataset-v1/tasks/SL-P1-REP-001-RANGE-NORMALIZATION/task-spec.json",
      "byte_length": 2960,
      "sha256": "25de6b6f330e09c076521b42a88d60712637e0fc7de7ab1cfe1f9f5d4c223321"
    },
    "source_preimage": {
      "path": "evaluation-harness/datasets/p1-representative-task-dataset-v1/tasks/SL-P1-REP-001-RANGE-NORMALIZATION/source-template/src/range.mjs",
      "byte_length": 115,
      "sha256": "1e3de2958c9841bbe785d903b2f5453389c4225359308b539ac2cb3194469d75",
      "mode": "100644"
    },
    "issue_test": {
      "path": "evaluation-harness/datasets/p1-representative-task-dataset-v1/tasks/SL-P1-REP-001-RANGE-NORMALIZATION/source-template/test/issue.test.mjs",
      "byte_length": 237,
      "sha256": "51fd472f8cf85fd595246814db29699ab81ccdc2986d80666d8609a8c4972b4b",
      "mode": "100644"
    },
    "regression_test": {
      "path": "evaluation-harness/datasets/p1-representative-task-dataset-v1/tasks/SL-P1-REP-001-RANGE-NORMALIZATION/source-template/test/regression.test.mjs",
      "byte_length": 241,
      "sha256": "381c573d8f99305b47db9f1a2ca49779842fe1187b9d7c5b7410e56dda9240c5",
      "mode": "100644"
    },
    "expected_base_failure": {
      "path": "evaluation-harness/datasets/p1-representative-task-dataset-v1/tasks/SL-P1-REP-001-RANGE-NORMALIZATION/expected-base-failure.json",
      "byte_length": 439,
      "sha256": "5dbe034939ed2178f86fd84ad409cff9426040f63343de27f7ad3e8f46dd2494"
    },
    "materialization_recipe": {
      "path": "evaluation-harness/datasets/p1-representative-task-dataset-v1/materialization-recipe.json",
      "byte_length": 456,
      "sha256": "104ed7109df7da155867a428b50575a9cda6bca481e183cebed50788c01a3a5e"
    }
  },
  "accepted_substrate": {
    "compiler": {
      "path": "evaluation-harness/harness/finite-typed-patch-ir-v1/compiler.mjs",
      "version": "SL-PATCH-IR-TRUSTED-COMPILER/1",
      "byte_length": 3814,
      "sha256": "013a58a6284270c6808f6cfe815dbea6825b8a43a0a6f885305df23890c7a4f9"
    },
    "independent_oracle": {
      "path": "evaluation-harness/evaluator/finite-typed-patch-ir-v1/quality-oracle.mjs",
      "version": "SL-PATCH-IR-QUALITY-ORACLE/1",
      "byte_length": 32410,
      "sha256": "8638ff9f6235203526420101be00f69745fbdc8c97a78a7e159550956bb4bb2f"
    },
    "success_program": {
      "path": "evaluation-harness/fixtures/finite-typed-patch-ir-v1/programs/ir10.json",
      "program_id": "IR10",
      "outcome_id": "CORRECT_END_START",
      "byte_length": 255,
      "sha256": "ac80def7bc984820b63243b020754715c1a7ad34e18e3ded2a4ee5c1961defcc"
    }
  },
  "closed_ir": {
    "schema": "SL-PATCH-IR/1",
    "maximum_proposal_bytes": 255,
    "admission_order": ["raw_buffer_type", "maximum_length", "sha256_index", "exact_length", "exact_raw_bytes"],
    "decode_or_parse": false,
    "closed_program_ids": ["IR00", "IR01", "IR10", "IR11"],
    "only_success_program_id": "IR10"
  },
  "worker_import_policy": {
    "scan_before_candidate_import_or_execution": true,
    "worker_files": [
      "evaluation-harness/adapters/p1-063-offline-b0-finite-ir-v1/offline-adapter.mjs",
      "evaluation-harness/harness/p1-063-offline-b0-finite-ir-v1/runner.mjs",
      "scripts/verify-p1-063-offline-b0-finite-ir-v1.sh"
    ],
    "static_import_allowlist": {
      "evaluation-harness/adapters/p1-063-offline-b0-finite-ir-v1/offline-adapter.mjs": ["../../harness/finite-typed-patch-ir-v1/compiler.mjs"],
      "evaluation-harness/harness/p1-063-offline-b0-finite-ir-v1/runner.mjs": [
        "node:child_process",
        "node:crypto",
        "node:fs",
        "node:os",
        "node:path",
        "node:url",
        "../../adapters/p1-063-offline-b0-finite-ir-v1/offline-adapter.mjs"
      ],
      "scripts/verify-p1-063-offline-b0-finite-ir-v1.sh": []
    },
    "dynamic_import_allowed": false,
    "require_allowed": false,
    "network_capable_import_or_api_allowed": false
  },
  "filesystem_policy": {
    "file_leaf": {
      "type": "regular",
      "symlink_allowed": false,
      "nlink_required": 1,
      "open_no_follow": true,
      "descriptor_and_path_dev_ino_must_match": true,
      "create_once": true
    },
    "directory": {
      "atomic_exclusive_mkdir": true,
      "recursive_mkdir": false,
      "type": "directory",
      "symlink_allowed": false,
      "realpath_must_equal_absolute_path": true,
      "dev_ino_identity_must_remain_stable": true,
      "nlink_gate": false
    }
  },
  "required_actions": [
    "validate_candidate_and_quality_identities",
    "validate_worker_import_surface",
    "validate_frozen_inputs",
    "validate_offline_submission",
    "materialize_fresh_rep001_repository",
    "verify_base_commit_tree_and_clean_state",
    "run_base_issue_test",
    "validate_typed_base_failure",
    "run_base_regression_test",
    "admit_exact_ir10_without_decode_or_parse",
    "atomically_replace_target",
    "verify_exact_changed_path",
    "run_patched_issue_test",
    "run_patched_regression_test",
    "restore_exact_base",
    "verify_exact_rollback",
    "emit_create_once_raw_evidence",
    "emit_stable_projection"
  ],
  "runner_interface": {
    "positive_submission_path_is_fixed": true,
    "open_submission_path_cli_allowed": false,
    "run_id_pattern": "^[a-z0-9][a-z0-9._-]{0,63}$",
    "quality_cli": {
      "preflight_candidate": "quality-evaluator.mjs preflight-candidate --candidate-manifest ABSOLUTE_FILE",
      "evaluate_run": "quality-evaluator.mjs evaluate-run --candidate-manifest ABSOLUTE_FILE --run-manifest ABSOLUTE_FILE",
      "compare_runs": "quality-evaluator.mjs compare-runs --run-a-review ABSOLUTE_FILE --run-b-review ABSOLUTE_FILE",
      "self_test": "quality-evaluator.mjs self-test"
    }
  },
  "candidate_manifest_contract": {
    "record_type": "sourcelens_aios_p1_063_candidate_manifest",
    "required_keys": ["schema_version", "record_type", "task_id", "candidate_commit", "candidate_tree", "quality_freeze_manifest_sha256", "worker_files_sorted_by_path"],
    "worker_file_required_keys": ["path", "byte_length", "sha256", "mode"]
  },
  "run_evidence_contract": {
    "run_manifest_record_type": "sourcelens_aios_p1_063_run_manifest",
    "run_manifest_required_keys": ["schema_version", "record_type", "task_id", "control_id", "run_id", "candidate_binding", "run_root", "artifacts", "evidence_files_sorted"],
    "required_artifacts": [
      { "id": "commands", "path": "commands.json" },
      { "id": "observation", "path": "observation.json" },
      { "id": "rollback", "path": "rollback.json" },
      { "id": "run_record", "path": "run-record.json" },
      { "id": "stable_projection", "path": "stable-projection.json" }
    ],
    "artifact_required_keys": ["id", "path", "byte_length", "sha256"],
    "raw_streams_retained_and_hash_bound": true,
    "manifest_is_not_a_success_oracle": true
  },
  "stable_projection": {
    "golden_path": "evaluation-harness/fixtures/p1-063-offline-b0-finite-ir-v1/golden-stable-projection.json",
    "candidate_placeholders": ["$CANDIDATE_COMMIT", "$CANDIDATE_TREE", "$CANDIDATE_MANIFEST_SHA256", "$QUALITY_FREEZE_MANIFEST_SHA256"],
    "canonical_json_required": true,
    "run_a_run_b_requirement": "EXACT_CANONICAL_JSON_BYTE_EQUALITY",
    "excluded_physical_fields": ["run_id", "physical_path", "realpath", "device", "inode", "pid", "started_at_utc", "finished_at_utc", "duration_ms", "cwd"]
  },
  "negative_control_acceptance": {
    "path": "evaluation-harness/fixtures/p1-063-offline-b0-finite-ir-v1/negative-cases.json",
    "scheduled": 28,
    "required_rejections": 28,
    "maximum_false_accepts": 0,
    "network_fixture_generation": "TEMPORARY_BYTES_SYNTHESIZED_WITHOUT_IMPORT_OR_EXECUTION"
  },
  "run_b_procedure": {
    "actor": "Independent Quality Reviewer",
    "must_not_read_run_a_before_run_b_evaluation": true,